{
  "$schema": "https://raw.githubusercontent.com/VlHash/miwifi-extension-framework/plugins/framework.schema.json",
  "schemaVersion": 1,
  "framework": "mwef",
  "author": "VlHash",
  "channel": "pre-release",
  "version": "0.3.0",
  "tag": "v0.3.0-pre.1",
  "publishedAt": "2026-08-22T18:00:00Z",
  "notesUrl": "https://github.com/VlHash/miwifi-extension-framework/releases/tag/v0.3.0-pre.1",
  "archive": {
    "filename": "mwef-0.3.0.tar.gz",
    "size": 96731,
    "sha256": "9084f7ff440173918e6947ce9dc22dbff41a85e7de445570220465459e172433",
    "urls": [
      "https://github.com/VlHash/miwifi-extension-framework/releases/download/v0.3.0-pre.1/mwef-0.3.0.tar.gz",
      "https://ghfast.top/https://github.com/VlHash/miwifi-extension-framework/releases/download/v0.3.0-pre.1/mwef-0.3.0.tar.gz"
    ]
  }
}
